{
 "accepted_blueprint_role": {
  "advances_plan": "Tetsuo's activation is the deck's repeatable removal, and the untap suite exists to reuse it.",
  "confidence": "high",
  "evidence_class": "strategic_judgment",
  "honest_note": "Commander-native control. The one Spellbook combo (283-4091, Illusionist's Bracers + Aphetto Alchemist) gives infinite untaps but no mana, so Tetsuo still pays {U}{B}{B}{R} per activation. There is no compact kill; the deck wins by grinding and combat. The source calls Tetsuo mana-intensive and board-dependent (blueprint L43).",
  "level": "central"
 },
 "authority": {
  "can_decide": false,
  "note": "Commander marginal-value vectors remain evidence; no scalar score or deck decision is emitted."
 },
 "canonical_hash": "lh1:da8056ed35918860c7fabf7529c8013bdd3acd369af4d1c3f92a86c3f3e046b7",
 "confidence": "low",
 "deck_id": "Tetsuo_Umezawa",
 "dimension_status": {
  "card_economy": "extra draws and tutors modeled by v1.1 only",
  "combo_assembly": "dynamic assembly/win proxies plus structural route dependence",
  "engines": "structural explicit-dependence evidence available; engine-online probability not modeled by v1.1",
  "mana_efficiency": "spent/available resource proxy through turn 6",
  "meaningful_actions": "reported as a non-collapsed meaningful-progress vector; no heterogeneous events are summed into one score",
  "package_access": "dynamic first-member access only; not package completion",
  "recovery": "bounded commander-removal/recast proxy",
  "strategic_routes": "accepted Blueprint + Step-B structural route evidence"
 },
 "dynamic_vectors": {
  "disrupted": {
   "card_economy": {
    "extra_cards_drawn_mean": 0.794,
    "tutors_resolved_mean": 0.312
   },
   "combo_access": {
    "combo_assembled_by_turn6": 0.058,
    "win_proxy_by_turn6": 0.058
   },
   "mana_efficiency": {
    "mana_available_t1_6_mean": 24.506,
    "mana_spent_t1_6_mean": 22.354,
    "spent_over_available_proxy": 0.912185
   },
   "meaningful_progress_vector": {
    "combo_assembled_by_turn6": 0.058,
    "commander_cast_by_turn6": 0.956,
    "expected_key_sets_first_accessed_by_turn4": 1.952,
    "extra_cards_drawn_mean": 0.794,
    "tutors_resolved_mean": 0.312
   },
   "package_access": {
    "expected_key_sets_first_accessed_by_turn4": 1.952,
    "first_key_set_access_by_turn4": {
     "pkg:payoffs": 0.454,
     "pkg:target-makers": 0.774,
     "pkg:untap": 0.724
    }
   },
   "recovery": {
    "recast_after_removal_share": 0.9918864097363083,
    "recovery_turns_mean": 1.2024539877300613,
    "removal_event_share": 0.986,
    "scenario": "commander_removed_twice from turn 4; for multi-commander decks the legacy stress hook removes one on-board commander at a time and is therefore only a bounded disruption proxy"
   }
  },
  "normal": {
   "card_economy": {
    "extra_cards_drawn_mean": 0.804,
    "tutors_resolved_mean": 0.314
   },
   "combo_access": {
    "combo_assembled_by_turn6": 0.066,
    "win_proxy_by_turn6": 0.066
   },
   "mana_efficiency": {
    "mana_available_t1_6_mean": 24.636,
    "mana_spent_t1_6_mean": 19.846,
    "spent_over_available_proxy": 0.805569
   },
   "meaningful_progress_vector": {
    "combo_assembled_by_turn6": 0.066,
    "commander_cast_by_turn6": 0.956,
    "expected_key_sets_first_accessed_by_turn4": 1.952,
    "extra_cards_drawn_mean": 0.804,
    "tutors_resolved_mean": 0.314
   },
   "package_access": {
    "expected_key_sets_first_accessed_by_turn4": 1.952,
    "first_key_set_access_by_turn4": {
     "pkg:payoffs": 0.454,
     "pkg:target-makers": 0.774,
     "pkg:untap": 0.724
    }
   },
   "recovery": null
  },
  "taxed": {
   "card_economy": {
    "extra_cards_drawn_mean": 0.804,
    "tutors_resolved_mean": 0.314
   },
   "combo_access": {
    "combo_assembled_by_turn6": 0.064,
    "win_proxy_by_turn6": 0.064
   },
   "mana_efficiency": {
    "mana_available_t1_6_mean": 24.818,
    "mana_spent_t1_6_mean": 20.984,
    "spent_over_available_proxy": 0.845515
   },
   "meaningful_progress_vector": {
    "combo_assembled_by_turn6": 0.064,
    "commander_cast_by_turn6": 0.896,
    "expected_key_sets_first_accessed_by_turn4": 1.952,
    "extra_cards_drawn_mean": 0.804,
    "tutors_resolved_mean": 0.314
   },
   "package_access": {
    "expected_key_sets_first_accessed_by_turn4": 1.952,
    "first_key_set_access_by_turn4": {
     "pkg:payoffs": 0.456,
     "pkg:target-makers": 0.776,
     "pkg:untap": 0.72
    }
   },
   "recovery": null
  },
  "unavailable": {
   "card_economy": {
    "extra_cards_drawn_mean": 0.804,
    "tutors_resolved_mean": 0.316
   },
   "combo_access": {
    "combo_assembled_by_turn6": 0.066,
    "win_proxy_by_turn6": 0.066
   },
   "mana_efficiency": {
    "mana_available_t1_6_mean": 24.996,
    "mana_spent_t1_6_mean": 18.346,
    "spent_over_available_proxy": 0.733957
   },
   "meaningful_progress_vector": {
    "combo_assembled_by_turn6": 0.066,
    "commander_cast_by_turn6": 0.0,
    "expected_key_sets_first_accessed_by_turn4": 1.96,
    "extra_cards_drawn_mean": 0.804,
    "tutors_resolved_mean": 0.316
   },
   "package_access": {
    "expected_key_sets_first_accessed_by_turn4": 1.96,
    "first_key_set_access_by_turn4": {
     "pkg:payoffs": 0.456,
     "pkg:target-makers": 0.776,
     "pkg:untap": 0.728
    }
   },
   "recovery": null
  }
 },
 "evidence_class": "test_result",
 "limitations": [
  "No dimension is converted into a universal commander-value score.",
  "Dynamic results inherit every grixis_sim v1.1 limitation and are not multiplayer win rates.",
  "Meaningful progress is a vector of separately interpretable components, not a count of heterogeneous actions.",
  "Package access is first access to any key-set member, not completion or engine-online probability.",
  "Commander-native triggered/activated abilities missing from v1.1 can make dynamic deltas understate real commander value; structural Blueprint evidence remains mandatory context.",
  "Partner-pair disruption remains a bounded one-at-a-time legacy stress proxy."
 ],
 "normal_minus_counterfactual": {
  "disrupted": {
   "card_economy": {
    "extra_cards_drawn_mean": 0.01,
    "tutors_resolved_mean": 0.002
   },
   "combo_access": {
    "combo_assembled_by_turn6": 0.008,
    "win_proxy_by_turn6": 0.008
   },
   "mana_efficiency": {
    "mana_available_t1_6_mean": 0.13,
    "mana_spent_t1_6_mean": -2.508,
    "spent_over_available_proxy": -0.106616
   },
   "meaningful_progress_vector": {
    "combo_assembled_by_turn6": 0.008,
    "commander_cast_by_turn6": 0.0,
    "expected_key_sets_first_accessed_by_turn4": 0.0,
    "extra_cards_drawn_mean": 0.01,
    "tutors_resolved_mean": 0.002
   },
   "package_access": {
    "expected_key_sets_first_accessed_by_turn4": 0.0
   }
  },
  "taxed": {
   "card_economy": {
    "extra_cards_drawn_mean": 0.0,
    "tutors_resolved_mean": 0.0
   },
   "combo_access": {
    "combo_assembled_by_turn6": 0.002,
    "win_proxy_by_turn6": 0.002
   },
   "mana_efficiency": {
    "mana_available_t1_6_mean": -0.182,
    "mana_spent_t1_6_mean": -1.138,
    "spent_over_available_proxy": -0.039946
   },
   "meaningful_progress_vector": {
    "combo_assembled_by_turn6": 0.002,
    "commander_cast_by_turn6": 0.06,
    "expected_key_sets_first_accessed_by_turn4": 0.0,
    "extra_cards_drawn_mean": 0.0,
    "tutors_resolved_mean": 0.0
   },
   "package_access": {
    "expected_key_sets_first_accessed_by_turn4": 0.0
   }
  },
  "unavailable": {
   "card_economy": {
    "extra_cards_drawn_mean": 0.0,
    "tutors_resolved_mean": -0.002
   },
   "combo_access": {
    "combo_assembled_by_turn6": 0.0,
    "win_proxy_by_turn6": 0.0
   },
   "mana_efficiency": {
    "mana_available_t1_6_mean": -0.36,
    "mana_spent_t1_6_mean": 1.5,
    "spent_over_available_proxy": 0.071612
   },
   "meaningful_progress_vector": {
    "combo_assembled_by_turn6": 0.0,
    "commander_cast_by_turn6": 0.956,
    "expected_key_sets_first_accessed_by_turn4": -0.008,
    "extra_cards_drawn_mean": 0.0,
    "tutors_resolved_mean": -0.002
   },
   "package_access": {
    "expected_key_sets_first_accessed_by_turn4": -0.008
   }
  }
 },
 "schema_version": 1,
 "slug": "tetsuo-umezawa",
 "status": "provisional_marginal_value_evidence",
 "structural_routes": {
  "combo_routes": [
   {
    "blueprint_commander_support": [
     "Tetsuo Umezawa"
    ],
    "cards": [
     "Illusionist's Bracers",
     "Aphetto Alchemist"
    ],
    "direct_commander_pieces": [],
    "id": "283-4091",
    "mode": "blueprint_supported",
    "structural_hint": "commander_supported_combo"
   }
  ],
  "engines": [
   {
    "commander_explicit": true,
    "commander_refs": [
     "Tetsuo Umezawa"
    ],
    "id": "destroy-tapped-or-blocking",
    "online_condition_mentions_commander": false
   },
   {
    "commander_explicit": false,
    "commander_refs": [],
    "id": "untap-suite",
    "online_condition_mentions_commander": false
   },
   {
    "commander_explicit": false,
    "commander_refs": [],
    "id": "copy-activation",
    "online_condition_mentions_commander": false
   }
  ],
  "summary": {
   "blueprint_wins": 2,
   "blueprint_wins_explicit_commander": 2,
   "blueprint_wins_structurally_independent": 0,
   "combo_blueprint_supported": 1,
   "combo_commander_independent": 0,
   "combo_direct_commander_piece": 0,
   "engines": 3,
   "engines_explicit_commander": 1,
   "required_packages": 2,
   "required_packages_explicit_commander": 0,
   "spellbook_lines": 1
  },
  "wins": [
   {
    "commander_explicit": true,
    "commander_refs": [
     "Tetsuo Umezawa"
    ],
    "confidence": "moderate",
    "evidence_class": "strategic_judgment",
    "id": "grind-and-goad",
    "kind": "natural"
   },
   {
    "commander_explicit": true,
    "commander_refs": [
     "Tetsuo Umezawa"
    ],
    "confidence": "moderate",
    "evidence_class": "strategic_judgment",
    "id": "bracers-alchemist",
    "kind": "combo"
   }
  ]
 }
}
