{
 "accepted_blueprint_role": {
  "advances_plan": "Sauron's cast trigger is the deck's best reanimation spell, and Command Beacon recasts it without tax.",
  "confidence": "high",
  "evidence_class": "strategic_judgment",
  "honest_note": "Commander-native but expensive: eight mana, and Spellbook finds no combos. The source calls the engine value/reanimation rather than a compact win (blueprint L21). The deck can win without him through cheap reanimation of Archon, Valgavoth or Jin-Gitaxias. Expect mid Bracket 4. M1 review (sauronlotr-01..05, all verified) confirms the cast trigger and reanimation rules.",
  "level": "central"
 },
 "authority": {
  "can_decide": false,
  "note": "Commander marginal-value vectors remain evidence; no scalar score or deck decision is emitted."
 },
 "canonical_hash": "lh1:56944f00fbf608fa7e6e13222c86caf17217bdbc7da4d681721dd6f3c42f3ebe",
 "confidence": "low",
 "deck_id": "Sauron__Lord_of_the_Rings",
 "dimension_status": {
  "card_economy": "extra draws and tutors modeled by v1.1 only",
  "combo_assembly": "dynamic assembly/win proxies plus structural route dependence",
  "engines": "structural explicit-dependence evidence available; engine-online probability not modeled by v1.1",
  "mana_efficiency": "spent/available resource proxy through turn 6",
  "meaningful_actions": "reported as a non-collapsed meaningful-progress vector; no heterogeneous events are summed into one score",
  "package_access": "dynamic first-member access only; not package completion",
  "recovery": "bounded commander-removal/recast proxy",
  "strategic_routes": "accepted Blueprint + Step-B structural route evidence"
 },
 "dynamic_vectors": {
  "disrupted": {
   "card_economy": {
    "extra_cards_drawn_mean": 1.454,
    "tutors_resolved_mean": 0.332
   },
   "combo_access": {
    "combo_assembled_by_turn6": null,
    "win_proxy_by_turn6": null
   },
   "mana_efficiency": {
    "mana_available_t1_6_mean": 24.106,
    "mana_spent_t1_6_mean": 19.062,
    "spent_over_available_proxy": 0.790757
   },
   "meaningful_progress_vector": {
    "combo_assembled_by_turn6": null,
    "commander_cast_by_turn6": 0.264,
    "expected_key_sets_first_accessed_by_turn4": 2.882,
    "extra_cards_drawn_mean": 1.454,
    "tutors_resolved_mean": 0.332
   },
   "package_access": {
    "expected_key_sets_first_accessed_by_turn4": 2.882,
    "first_key_set_access_by_turn4": {
     "pkg:fast-mana": 0.832,
     "pkg:reanimation": 0.708,
     "pkg:ring-orc": 0.704,
     "pkg:targets": 0.638
    }
   },
   "recovery": {
    "recast_after_removal_share": 0.39946380697050937,
    "recovery_turns_mean": 2.4161073825503356,
    "removal_event_share": 0.746,
    "scenario": "commander_removed_twice from turn 4; for multi-commander decks the legacy stress hook removes one on-board commander at a time and is therefore only a bounded disruption proxy"
   }
  },
  "normal": {
   "card_economy": {
    "extra_cards_drawn_mean": 1.458,
    "tutors_resolved_mean": 0.332
   },
   "combo_access": {
    "combo_assembled_by_turn6": null,
    "win_proxy_by_turn6": null
   },
   "mana_efficiency": {
    "mana_available_t1_6_mean": 24.112,
    "mana_spent_t1_6_mean": 18.938,
    "spent_over_available_proxy": 0.785418
   },
   "meaningful_progress_vector": {
    "combo_assembled_by_turn6": null,
    "commander_cast_by_turn6": 0.264,
    "expected_key_sets_first_accessed_by_turn4": 2.882,
    "extra_cards_drawn_mean": 1.458,
    "tutors_resolved_mean": 0.332
   },
   "package_access": {
    "expected_key_sets_first_accessed_by_turn4": 2.882,
    "first_key_set_access_by_turn4": {
     "pkg:fast-mana": 0.832,
     "pkg:reanimation": 0.708,
     "pkg:ring-orc": 0.704,
     "pkg:targets": 0.638
    }
   },
   "recovery": null
  },
  "taxed": {
   "card_economy": {
    "extra_cards_drawn_mean": 1.45,
    "tutors_resolved_mean": 0.336
   },
   "combo_access": {
    "combo_assembled_by_turn6": null,
    "win_proxy_by_turn6": null
   },
   "mana_efficiency": {
    "mana_available_t1_6_mean": 24.208,
    "mana_spent_t1_6_mean": 17.952,
    "spent_over_available_proxy": 0.741573
   },
   "meaningful_progress_vector": {
    "combo_assembled_by_turn6": null,
    "commander_cast_by_turn6": 0.048,
    "expected_key_sets_first_accessed_by_turn4": 2.882,
    "extra_cards_drawn_mean": 1.45,
    "tutors_resolved_mean": 0.336
   },
   "package_access": {
    "expected_key_sets_first_accessed_by_turn4": 2.882,
    "first_key_set_access_by_turn4": {
     "pkg:fast-mana": 0.832,
     "pkg:reanimation": 0.708,
     "pkg:ring-orc": 0.704,
     "pkg:targets": 0.638
    }
   },
   "recovery": null
  },
  "unavailable": {
   "card_economy": {
    "extra_cards_drawn_mean": 1.452,
    "tutors_resolved_mean": 0.336
   },
   "combo_access": {
    "combo_assembled_by_turn6": null,
    "win_proxy_by_turn6": null
   },
   "mana_efficiency": {
    "mana_available_t1_6_mean": 24.282,
    "mana_spent_t1_6_mean": 17.528,
    "spent_over_available_proxy": 0.721852
   },
   "meaningful_progress_vector": {
    "combo_assembled_by_turn6": null,
    "commander_cast_by_turn6": 0.0,
    "expected_key_sets_first_accessed_by_turn4": 2.882,
    "extra_cards_drawn_mean": 1.452,
    "tutors_resolved_mean": 0.336
   },
   "package_access": {
    "expected_key_sets_first_accessed_by_turn4": 2.882,
    "first_key_set_access_by_turn4": {
     "pkg:fast-mana": 0.832,
     "pkg:reanimation": 0.708,
     "pkg:ring-orc": 0.704,
     "pkg:targets": 0.638
    }
   },
   "recovery": null
  }
 },
 "evidence_class": "test_result",
 "limitations": [
  "No dimension is converted into a universal commander-value score.",
  "Dynamic results inherit every grixis_sim v1.1 limitation and are not multiplayer win rates.",
  "Meaningful progress is a vector of separately interpretable components, not a count of heterogeneous actions.",
  "Package access is first access to any key-set member, not completion or engine-online probability.",
  "Commander-native triggered/activated abilities missing from v1.1 can make dynamic deltas understate real commander value; structural Blueprint evidence remains mandatory context.",
  "Partner-pair disruption remains a bounded one-at-a-time legacy stress proxy."
 ],
 "normal_minus_counterfactual": {
  "disrupted": {
   "card_economy": {
    "extra_cards_drawn_mean": 0.004,
    "tutors_resolved_mean": 0.0
   },
   "combo_access": {
    "combo_assembled_by_turn6": null,
    "win_proxy_by_turn6": null
   },
   "mana_efficiency": {
    "mana_available_t1_6_mean": 0.006,
    "mana_spent_t1_6_mean": -0.124,
    "spent_over_available_proxy": -0.005339
   },
   "meaningful_progress_vector": {
    "combo_assembled_by_turn6": null,
    "commander_cast_by_turn6": 0.0,
    "expected_key_sets_first_accessed_by_turn4": 0.0,
    "extra_cards_drawn_mean": 0.004,
    "tutors_resolved_mean": 0.0
   },
   "package_access": {
    "expected_key_sets_first_accessed_by_turn4": 0.0
   }
  },
  "taxed": {
   "card_economy": {
    "extra_cards_drawn_mean": 0.008,
    "tutors_resolved_mean": -0.004
   },
   "combo_access": {
    "combo_assembled_by_turn6": null,
    "win_proxy_by_turn6": null
   },
   "mana_efficiency": {
    "mana_available_t1_6_mean": -0.096,
    "mana_spent_t1_6_mean": 0.986,
    "spent_over_available_proxy": 0.043845
   },
   "meaningful_progress_vector": {
    "combo_assembled_by_turn6": null,
    "commander_cast_by_turn6": 0.216,
    "expected_key_sets_first_accessed_by_turn4": 0.0,
    "extra_cards_drawn_mean": 0.008,
    "tutors_resolved_mean": -0.004
   },
   "package_access": {
    "expected_key_sets_first_accessed_by_turn4": 0.0
   }
  },
  "unavailable": {
   "card_economy": {
    "extra_cards_drawn_mean": 0.006,
    "tutors_resolved_mean": -0.004
   },
   "combo_access": {
    "combo_assembled_by_turn6": null,
    "win_proxy_by_turn6": null
   },
   "mana_efficiency": {
    "mana_available_t1_6_mean": -0.17,
    "mana_spent_t1_6_mean": 1.41,
    "spent_over_available_proxy": 0.063566
   },
   "meaningful_progress_vector": {
    "combo_assembled_by_turn6": null,
    "commander_cast_by_turn6": 0.264,
    "expected_key_sets_first_accessed_by_turn4": 0.0,
    "extra_cards_drawn_mean": 0.006,
    "tutors_resolved_mean": -0.004
   },
   "package_access": {
    "expected_key_sets_first_accessed_by_turn4": 0.0
   }
  }
 },
 "schema_version": 1,
 "slug": "sauron-lord-of-the-rings",
 "status": "provisional_marginal_value_evidence",
 "structural_routes": {
  "combo_routes": [],
  "engines": [
   {
    "commander_explicit": true,
    "commander_refs": [
     "Sauron, Lord of the Rings"
    ],
    "id": "cast-trigger",
    "online_condition_mentions_commander": false
   },
   {
    "commander_explicit": false,
    "commander_refs": [],
    "id": "setup-and-reanimate",
    "online_condition_mentions_commander": false
   }
  ],
  "summary": {
   "blueprint_wins": 2,
   "blueprint_wins_explicit_commander": 2,
   "blueprint_wins_structurally_independent": 0,
   "combo_blueprint_supported": 0,
   "combo_commander_independent": 0,
   "combo_direct_commander_piece": 0,
   "engines": 2,
   "engines_explicit_commander": 1,
   "required_packages": 3,
   "required_packages_explicit_commander": 0,
   "spellbook_lines": 0
  },
  "wins": [
   {
    "commander_explicit": true,
    "commander_refs": [
     "Sauron, Lord of the Rings"
    ],
    "confidence": "high",
    "evidence_class": "strategic_judgment",
    "id": "reanimated-threats",
    "kind": "natural"
   },
   {
    "commander_explicit": true,
    "commander_refs": [
     "Sauron, Lord of the Rings"
    ],
    "confidence": "moderate",
    "evidence_class": "strategic_judgment",
    "id": "ring-orcs",
    "kind": "natural"
   }
  ]
 }
}
