{
 "accepted_blueprint_role": {
  "advances_plan": "Sauron makes the Army, turns its hits into Ring temptations and card draw, and is protected by a legendary-sacrifice ward.",
  "confidence": "high",
  "evidence_class": "strategic_judgment",
  "honest_note": "Commander-native, with no compact win: Spellbook finds no combos, and the source rejected Oracle/Breach conversion (decisions L34). The deck wins by Army/Nazgûl combat and card flow. There is no source blueprint file; the closeout and verification are the evidence. M1 review (saurondl-01..05, all verified) confirms the Army/Ring loop.",
  "level": "central"
 },
 "authority": {
  "can_decide": false,
  "note": "Commander marginal-value vectors remain evidence; no scalar score or deck decision is emitted."
 },
 "canonical_hash": "lh1:bbac35497c11953c26540c28d14d51eb101a8ac86a915fe12b4c6aaba796594a",
 "confidence": "low",
 "deck_id": "Sauron__the_Dark_Lord",
 "dimension_status": {
  "card_economy": "extra draws and tutors modeled by v1.1 only",
  "combo_assembly": "dynamic assembly/win proxies plus structural route dependence",
  "engines": "structural explicit-dependence evidence available; engine-online probability not modeled by v1.1",
  "mana_efficiency": "spent/available resource proxy through turn 6",
  "meaningful_actions": "reported as a non-collapsed meaningful-progress vector; no heterogeneous events are summed into one score",
  "package_access": "dynamic first-member access only; not package completion",
  "recovery": "bounded commander-removal/recast proxy",
  "strategic_routes": "accepted Blueprint + Step-B structural route evidence"
 },
 "dynamic_vectors": {
  "disrupted": {
   "card_economy": {
    "extra_cards_drawn_mean": 1.646,
    "tutors_resolved_mean": 0.67
   },
   "combo_access": {
    "combo_assembled_by_turn6": null,
    "win_proxy_by_turn6": null
   },
   "mana_efficiency": {
    "mana_available_t1_6_mean": 22.992,
    "mana_spent_t1_6_mean": 20.066,
    "spent_over_available_proxy": 0.872738
   },
   "meaningful_progress_vector": {
    "combo_assembled_by_turn6": null,
    "commander_cast_by_turn6": 0.676,
    "expected_key_sets_first_accessed_by_turn4": 1.844,
    "extra_cards_drawn_mean": 1.646,
    "tutors_resolved_mean": 0.67
   },
   "package_access": {
    "expected_key_sets_first_accessed_by_turn4": 1.844,
    "first_key_set_access_by_turn4": {
     "pkg:army-support": 0.712,
     "pkg:evasion": 0.478,
     "pkg:nazgul": 0.654
    }
   },
   "recovery": {
    "recast_after_removal_share": 0.7124183006535948,
    "recovery_turns_mean": 2.311926605504587,
    "removal_event_share": 0.918,
    "scenario": "commander_removed_twice from turn 4; for multi-commander decks the legacy stress hook removes one on-board commander at a time and is therefore only a bounded disruption proxy"
   }
  },
  "normal": {
   "card_economy": {
    "extra_cards_drawn_mean": 1.624,
    "tutors_resolved_mean": 0.674
   },
   "combo_access": {
    "combo_assembled_by_turn6": null,
    "win_proxy_by_turn6": null
   },
   "mana_efficiency": {
    "mana_available_t1_6_mean": 22.996,
    "mana_spent_t1_6_mean": 19.58,
    "spent_over_available_proxy": 0.851452
   },
   "meaningful_progress_vector": {
    "combo_assembled_by_turn6": null,
    "commander_cast_by_turn6": 0.676,
    "expected_key_sets_first_accessed_by_turn4": 1.844,
    "extra_cards_drawn_mean": 1.624,
    "tutors_resolved_mean": 0.674
   },
   "package_access": {
    "expected_key_sets_first_accessed_by_turn4": 1.844,
    "first_key_set_access_by_turn4": {
     "pkg:army-support": 0.712,
     "pkg:evasion": 0.478,
     "pkg:nazgul": 0.654
    }
   },
   "recovery": null
  },
  "taxed": {
   "card_economy": {
    "extra_cards_drawn_mean": 1.602,
    "tutors_resolved_mean": 0.674
   },
   "combo_access": {
    "combo_assembled_by_turn6": null,
    "win_proxy_by_turn6": null
   },
   "mana_efficiency": {
    "mana_available_t1_6_mean": 23.04,
    "mana_spent_t1_6_mean": 18.554,
    "spent_over_available_proxy": 0.805295
   },
   "meaningful_progress_vector": {
    "combo_assembled_by_turn6": null,
    "commander_cast_by_turn6": 0.198,
    "expected_key_sets_first_accessed_by_turn4": 1.848,
    "extra_cards_drawn_mean": 1.602,
    "tutors_resolved_mean": 0.674
   },
   "package_access": {
    "expected_key_sets_first_accessed_by_turn4": 1.848,
    "first_key_set_access_by_turn4": {
     "pkg:army-support": 0.712,
     "pkg:evasion": 0.48,
     "pkg:nazgul": 0.656
    }
   },
   "recovery": null
  },
  "unavailable": {
   "card_economy": {
    "extra_cards_drawn_mean": 1.59,
    "tutors_resolved_mean": 0.676
   },
   "combo_access": {
    "combo_assembled_by_turn6": null,
    "win_proxy_by_turn6": null
   },
   "mana_efficiency": {
    "mana_available_t1_6_mean": 23.108,
    "mana_spent_t1_6_mean": 17.53,
    "spent_over_available_proxy": 0.758612
   },
   "meaningful_progress_vector": {
    "combo_assembled_by_turn6": null,
    "commander_cast_by_turn6": 0.0,
    "expected_key_sets_first_accessed_by_turn4": 1.848,
    "extra_cards_drawn_mean": 1.59,
    "tutors_resolved_mean": 0.676
   },
   "package_access": {
    "expected_key_sets_first_accessed_by_turn4": 1.848,
    "first_key_set_access_by_turn4": {
     "pkg:army-support": 0.712,
     "pkg:evasion": 0.48,
     "pkg:nazgul": 0.656
    }
   },
   "recovery": null
  }
 },
 "evidence_class": "test_result",
 "limitations": [
  "No dimension is converted into a universal commander-value score.",
  "Dynamic results inherit every grixis_sim v1.1 limitation and are not multiplayer win rates.",
  "Meaningful progress is a vector of separately interpretable components, not a count of heterogeneous actions.",
  "Package access is first access to any key-set member, not completion or engine-online probability.",
  "Commander-native triggered/activated abilities missing from v1.1 can make dynamic deltas understate real commander value; structural Blueprint evidence remains mandatory context.",
  "Partner-pair disruption remains a bounded one-at-a-time legacy stress proxy."
 ],
 "normal_minus_counterfactual": {
  "disrupted": {
   "card_economy": {
    "extra_cards_drawn_mean": -0.022,
    "tutors_resolved_mean": 0.004
   },
   "combo_access": {
    "combo_assembled_by_turn6": null,
    "win_proxy_by_turn6": null
   },
   "mana_efficiency": {
    "mana_available_t1_6_mean": 0.004,
    "mana_spent_t1_6_mean": -0.486,
    "spent_over_available_proxy": -0.021286
   },
   "meaningful_progress_vector": {
    "combo_assembled_by_turn6": null,
    "commander_cast_by_turn6": 0.0,
    "expected_key_sets_first_accessed_by_turn4": 0.0,
    "extra_cards_drawn_mean": -0.022,
    "tutors_resolved_mean": 0.004
   },
   "package_access": {
    "expected_key_sets_first_accessed_by_turn4": 0.0
   }
  },
  "taxed": {
   "card_economy": {
    "extra_cards_drawn_mean": 0.022,
    "tutors_resolved_mean": 0.0
   },
   "combo_access": {
    "combo_assembled_by_turn6": null,
    "win_proxy_by_turn6": null
   },
   "mana_efficiency": {
    "mana_available_t1_6_mean": -0.044,
    "mana_spent_t1_6_mean": 1.026,
    "spent_over_available_proxy": 0.046157
   },
   "meaningful_progress_vector": {
    "combo_assembled_by_turn6": null,
    "commander_cast_by_turn6": 0.478,
    "expected_key_sets_first_accessed_by_turn4": -0.004,
    "extra_cards_drawn_mean": 0.022,
    "tutors_resolved_mean": 0.0
   },
   "package_access": {
    "expected_key_sets_first_accessed_by_turn4": -0.004
   }
  },
  "unavailable": {
   "card_economy": {
    "extra_cards_drawn_mean": 0.034,
    "tutors_resolved_mean": -0.002
   },
   "combo_access": {
    "combo_assembled_by_turn6": null,
    "win_proxy_by_turn6": null
   },
   "mana_efficiency": {
    "mana_available_t1_6_mean": -0.112,
    "mana_spent_t1_6_mean": 2.05,
    "spent_over_available_proxy": 0.09284
   },
   "meaningful_progress_vector": {
    "combo_assembled_by_turn6": null,
    "commander_cast_by_turn6": 0.676,
    "expected_key_sets_first_accessed_by_turn4": -0.004,
    "extra_cards_drawn_mean": 0.034,
    "tutors_resolved_mean": -0.002
   },
   "package_access": {
    "expected_key_sets_first_accessed_by_turn4": -0.004
   }
  }
 },
 "schema_version": 1,
 "slug": "sauron-the-dark-lord",
 "status": "provisional_marginal_value_evidence",
 "structural_routes": {
  "combo_routes": [],
  "engines": [
   {
    "commander_explicit": true,
    "commander_refs": [
     "Sauron, the Dark Lord"
    ],
    "id": "opponent-spell-amass",
    "online_condition_mentions_commander": false
   },
   {
    "commander_explicit": true,
    "commander_refs": [
     "Sauron, the Dark Lord"
    ],
    "id": "ring-draw",
    "online_condition_mentions_commander": false
   }
  ],
  "summary": {
   "blueprint_wins": 2,
   "blueprint_wins_explicit_commander": 2,
   "blueprint_wins_structurally_independent": 0,
   "combo_blueprint_supported": 0,
   "combo_commander_independent": 0,
   "combo_direct_commander_piece": 0,
   "engines": 2,
   "engines_explicit_commander": 2,
   "required_packages": 3,
   "required_packages_explicit_commander": 0,
   "spellbook_lines": 0
  },
  "wins": [
   {
    "commander_explicit": true,
    "commander_refs": [
     "Sauron, the Dark Lord"
    ],
    "confidence": "high",
    "evidence_class": "strategic_judgment",
    "id": "army-nazgul-combat",
    "kind": "natural"
   },
   {
    "commander_explicit": true,
    "commander_refs": [
     "Sauron, the Dark Lord"
    ],
    "confidence": "moderate",
    "evidence_class": "strategic_judgment",
    "id": "great-goblin-pings",
    "kind": "natural"
   }
  ]
 }
}
